{
  "schema_version": "library.collection/1.0.0",
  "collection_id": "world-recipes",
  "record_class": "fixture",
  "publication_ready": false,
  "record_notice": "Mixed collection of three kinds. Thirteen records are sourced: their cooking facts are summarized in this project's own words from the pages each record cites. Eight are original practical notes written here for a small air fryer, citing nothing because they claim nothing that needs a citation. Three are fixtures, authored to exercise the content contract, and are not knowledge records at all. Nothing in the collection has been kitchen-tested here or given a professional food-safety review, and every record says which kind it is. The record_class on this manifest describes the manifest text itself, which is still original writing.",
  "title": {
    "primary": "World Recipes",
    "alt": ["世界食谱"]
  },
  "description": "The Library's first themed collection. It holds recipe knowledge items with their regional variants, provenance, version history, and rights review kept as first-class record fields rather than presentation state.",
  "scope_note": "Contains twenty-four records of three kinds. Thirteen are sourced beginner oven recipes, each citing the page its quantities, oven temperature and timings come from, plus the food-safety authority behind any temperature threshold it states; they are editorially checked against those sources but untested in any kitchen here and not publication-ready. Eight are original practical notes in the Quick Air-Fryer section, written here rather than retrieved: they carry no sources because they make no claim about any published recipe, and where one gives a cook-to temperature it hands the reader back to their own food-safety authority. Three are illustrative fixture records, seeded so the hall, gallery, search, region filter and detail views can be built and checked end to end. No record carries an image, an authenticity claim, or a cooking-test result. A sourced record requires record_class 'sourced', at least one identified source URL, and a rights review; a practical note requires record_class 'practical-note' and no sources at all. The content rules in src/rules.mjs enforce both gates.",
  "item_ids": [
    "wr-oven-lamb-kofta-traybake",
    "wr-oven-lamb-potato-bake",
    "wr-oven-chicken-thigh-traybake",
    "wr-oven-salmon-traybake",
    "wr-oven-halloumi-chickpea-traybake",
    "wr-oven-root-veg-traybake",
    "wr-oven-portuguese-chicken-potato-bake",
    "wr-oven-puttanesca-fish-traybake",
    "wr-oven-roasted-veg-gnocchi-bake",
    "wr-oven-baked-ziti",
    "wr-oven-cumin-lamb-rack-roast",
    "wr-oven-rosemary-garlic-lamb-mini-roast",
    "wr-oven-slow-roast-lamb-shoulder",
    "wr-airfryer-crispy-tofu",
    "wr-airfryer-chicken-thigh-bites",
    "wr-airfryer-salmon-fillet",
    "wr-airfryer-broccoli-mixed-veg",
    "wr-airfryer-sweet-potato-wedges",
    "wr-airfryer-bean-cheese-quesadilla",
    "wr-airfryer-frozen-veg-dumplings",
    "wr-airfryer-garlic-lemon-salmon",
    "wr-fixture-griddle-flatbread",
    "wr-fixture-rice-porridge",
    "wr-fixture-simmered-bean-soup"
  ],
  "sections": [
    {
      "section_id": "quick-air-fryer",
      "title": "Quick Air-Fryer",
      "intro": "Eight original practical notes for one small air fryer and an ordinary supermarket shop, five of them vegetarian. Each gives a temperature in Celsius, a time, and the single check that actually decides when the food is done; the one written for a shared table also says how long the dish may stand. None has been cooked in a test kitchen or reviewed by a food-safety professional, and none cites a source, because none is claiming one.",
      "item_ids": [
        "wr-airfryer-crispy-tofu",
        "wr-airfryer-chicken-thigh-bites",
        "wr-airfryer-salmon-fillet",
        "wr-airfryer-broccoli-mixed-veg",
        "wr-airfryer-sweet-potato-wedges",
        "wr-airfryer-bean-cheese-quesadilla",
        "wr-airfryer-frozen-veg-dumplings",
        "wr-airfryer-garlic-lemon-salmon"
      ]
    }
  ],
  "reviewed_at": "2026-10-06",
  "record_version": "1.7.0",
  "change_history": [
    {
      "version": "1.7.0",
      "date": "2026-10-06",
      "change": "Added three further sourced oven recipes, all lamb and all built on Australian supermarket cuts — a cumin and paprika lamb rack roast for one or two, a rosemary-garlic lamb leg mini roast, and a slow-roast lamb shoulder — placed after the second oven batch and before the Quick Air-Fryer notes. Each cites its recipe page, plus the guides behind every temperature it states: Health Canada and Food Standards Australia New Zealand for safety and leftovers, and Australian Lamb's doneness guide, labelled as an eating-quality guide, for the two cuts that may be served pink. All were accessed 2026-10-06. The two earlier lamb records, every other record, the section, and the fixtures are unchanged.",
      "supersedes": "1.6.0"
    },
    {
      "version": "1.6.0",
      "date": "2026-10-06",
      "change": "Added four further sourced beginner oven recipes — a Portuguese-style chicken and potato bake, a puttanesca fish traybake, a roasted vegetable gnocchi bake, and a baked ziti — placed after the six earlier oven records and before the Quick Air-Fryer notes. Each cites its recipe page, plus Health Canada for every temperature threshold it states; all four were accessed 2026-10-06. Every existing record, the section, and the fixtures are unchanged.",
      "supersedes": "1.5.0"
    },
    {
      "version": "1.5.0",
      "date": "2026-09-23",
      "change": "Added an eighth original practical note to the Quick Air-Fryer section: a garlic and lemon salmon written for a shared table, carrying a measured cook-to temperature, a transport rule and a cumulative holding clock. It is a new record placed at the end of the section and of the air-fryer run in the manifest; the existing salmon note, which deliberately states no temperature of its own, is unchanged, as is every other record.",
      "supersedes": "1.4.0"
    },
    {
      "version": "1.4.0",
      "date": "2026-09-16",
      "change": "Shortened the Quick Air-Fryer section introduction to the context a reader needs at a glance, dropping the dish-by-dish enumeration and the timing generalization while keeping every disclaimer. The section is now presented as a lens over the single catalogue rather than as a second list of its members. Membership, order, record classes, sources, and rights are unchanged.",
      "supersedes": "1.3.0"
    },
    {
      "version": "1.3.0",
      "date": "2026-09-16",
      "change": "Added the Quick Air-Fryer section: seven original practical notes, a new record class that is neither sourced nor fixture, placed between the sourced oven set and the three fixtures. The collection gained its first editorial section, which groups those seven without changing anyone's membership. No existing record changed.",
      "supersedes": "1.2.0"
    },
    {
      "version": "1.2.0",
      "date": "2026-09-14",
      "change": "Added four further sourced beginner oven recipes — chicken thigh, salmon, halloumi and chickpea, and root vegetable — after the two already released and before the three fixtures. The three fixtures and the two earlier sourced records are unchanged in substance.",
      "supersedes": "1.1.0"
    },
    {
      "version": "1.1.0",
      "date": "2026-09-14",
      "change": "Added two sourced beginner oven recipes ahead of the three existing fixtures, which are unchanged. The collection is now mixed, and the notice and scope note say so.",
      "supersedes": "1.0.0"
    },
    {
      "version": "1.0.0",
      "date": "2026-09-13",
      "change": "Initial fixture collection created alongside the first Library framework build. No prior version exists.",
      "supersedes": null
    }
  ],
  "rights": {
    "content_license": "Original text authored for this repository; reusable under the repository's own terms once the owner sets them. Rights in the pages the sourced records cite remain with their authors and publishers.",
    "license_review_state": "fixture-original-text"
  }
}
